{
  "mission_id": "M-TEST-001",
  "version": "1.1",
  "status": "planned",
  "priority": 5,
  "owner": "famaoai",
  "tenant_id": "famaocloud",
  "vision_ref": "/vision/_default.md",
  "assigned_persona": "Ecosystem Architect",
  "git": {
    "branch": "mission/m-test-001",
    "checkpoints": []
  },
  "milestones": [
    {
      "id": "M1",
      "title": "Initialization",
      "status": "completed",
      "completed_at": "2026-03-05T23:54:03.050Z"
    },
    {
      "id": "M2",
      "title": "Implementation",
      "status": "pending"
    },
    {
      "id": "M3",
      "title": "Validation",
      "status": "pending"
    }
  ],
  "context": {
    "associated_projects": []
  },
  "history": [
    {
      "ts": "2026-03-05T23:54:03.050Z",
      "event": "CREATED",
      "note": "Mission created for tenant: famaocloud"
    }
  ]
}